{
  "contract_version": "3.1.0",
  "source_documents": ["01_CURRENT_TOPOLOGY_ARCHITECTURE_2026-08-30.md", "02_AUTOCAD_BLOCK_ATTRIBUTE_REFERENCE_2026-08-30.md"],
  "approved_block_names": [
    "FRAME_1","FRAME_2","FRAME_3","FRAME_4","FRAME_5","FRAME_1_IP44","FRAME_2_IP44","FRAME_3_IP44",
    "LIGHT_OUT_230V","LIGHT_IN_230V","LIGHT_OUT_DALI_230V","LIGHT_IN_DALI_230V","LIGHT_TRACK_230V","LIGHT_TRACK_48V","LIGHT_TRACK_DALI_48V","LIGHT_IN_IP44","LIGHT_OUT_IP54","LIGHT_LUSTRA","LIGHT_BRA","LIGHT_BRA_IP54",
    "LIGHT_LED","LIGHT_LED_IP67","TRACK_230V","TRACK_48V","TRACK_DALI",
    "SW_IN_1","SW_IN_2","SW_IN_3","SW_IN_4","SW_OUT_1","SW_OUT_2","SW_IN_1_IP44","SW_IN_2_IP44","SW_OUT_1_IP44","SW_OUT_2_IP44",
    "BTN_IN_1","BTN_IN_2","BTN_IN_3","BTN_IN_4","SOCKET_IN","SOCKET_IN_IP44","SOCKET_OUT","SOCKET_OUT_IP54","SOCKET_OUT_380V","SOCKET_ETHERNET",
    "CABLE_OUTLET","CABLE_OUTLET_FRAME","CABLE_OUTLET_DALI","CABLE_OUTLET_FRAME_DALI","SENSOR_1WIRE","SENSOR_MSW","SENSOR_WATER","SENSOR_MOTION","FAN","AIR_VALVE",
    "CONTROL_PANEL_4","CONTROL_PANEL_9","CONTROL_PANEL_10","CONTROL_PANEL_11","BOARD_IN","BOARD_OUT","BOARD_OUT_IP44","BOARD_OUT_IP54","BOARD_OUT_IP67","BOARD_PANEL",
    "EL_BOX_OUT_100x100","WB_M1W2","WB_MAI2","WB_MRM2_MINI","DALI_GROUP","ROOM_NAME"
  ],
  "block_name_pattern": "^[A-Z0-9]+(?:_[A-Z0-9]+)*(?:x[0-9]+)?$",
  "track_id_pattern": "^TRACK\\.[0-9]{3}$",
  "track_mount_way_values": ["накладной", "встроенный", "подвесной"],
  "attribute_profiles": {
    "FRAME": {"required":[],"optional":["DEVICE_NAME","BUILDING","ROOM","MOUNT_HEIGHT"],"definition_required":["DEVICE_NAME","BUILDING","ROOM","MOUNT_HEIGHT"]},
    "CABLE_LOAD": {"required":[],"optional":["DEVICE_NAME","BUILDING","ROOM","MOUNT_HEIGHT","CABLE_ID","CABLE_TYPE","BOARD","CABLE_SOURCE","MOUNT_WAY","GOFRA_TYPE","GOFRA_COLOR","GOFRA_ID","LOAD_TYPE","LOAD_NAME","CALC_POWER","COMMENT_1","COMMENT_2"],"definition_required":["DEVICE_NAME","BUILDING","ROOM","MOUNT_HEIGHT","CABLE_ID","CABLE_TYPE","BOARD","CABLE_SOURCE","MOUNT_WAY","GOFRA_TYPE","GOFRA_COLOR","GOFRA_ID","LOAD_TYPE","LOAD_NAME","CALC_POWER","COMMENT_1","COMMENT_2"]},
    "DALI_CABLE_LOAD": {"required":[],"optional":["DEVICE_NAME","BUILDING","ROOM","MOUNT_HEIGHT","CABLE_ID","CABLE_TYPE","BOARD","CABLE_SOURCE","MOUNT_WAY","GOFRA_TYPE","GOFRA_COLOR","GOFRA_ID","BUS_POINT_ID","BUS_SOURCE","BUS_CABLE_TYPE","BUS_MOUNT_WAY","BUS_GOFRA_TYPE","BUS_GOFRA_COLOR","BUS_GOFRA_ID","LOAD_TYPE","LOAD_NAME","CALC_POWER","COMMENT_1","COMMENT_2"],"definition_required":["DEVICE_NAME","BUILDING","ROOM","MOUNT_HEIGHT","CABLE_ID","CABLE_TYPE","BOARD","CABLE_SOURCE","MOUNT_WAY","GOFRA_TYPE","GOFRA_COLOR","GOFRA_ID","BUS_POINT_ID","BUS_SOURCE","BUS_CABLE_TYPE","BUS_MOUNT_WAY","BUS_GOFRA_TYPE","BUS_GOFRA_COLOR","BUS_GOFRA_ID","LOAD_TYPE","LOAD_NAME","CALC_POWER","COMMENT_1","COMMENT_2"]},
    "TRACK_LIGHT": {"required":[],"optional":["DEVICE_NAME","BUILDING","ROOM","MOUNT_HEIGHT","CABLE_ID","CABLE_SOURCE","LOAD_TYPE","LOAD_NAME","CALC_POWER","COMMENT_1","COMMENT_2"],"definition_required":["DEVICE_NAME","BUILDING","ROOM","MOUNT_HEIGHT","CABLE_ID","CABLE_SOURCE","LOAD_TYPE","LOAD_NAME","CALC_POWER","COMMENT_1","COMMENT_2"]},
    "TRACK_DALI_LIGHT": {"required":[],"optional":["DEVICE_NAME","BUILDING","ROOM","MOUNT_HEIGHT","CABLE_ID","CABLE_SOURCE","BUS_POINT_ID","BUS_SOURCE","LOAD_TYPE","LOAD_NAME","CALC_POWER","COMMENT_1","COMMENT_2"],"definition_required":["DEVICE_NAME","BUILDING","ROOM","MOUNT_HEIGHT","CABLE_ID","CABLE_SOURCE","BUS_POINT_ID","BUS_SOURCE","LOAD_TYPE","LOAD_NAME","CALC_POWER","COMMENT_1","COMMENT_2"]},
    "LED": {"required":[],"optional":["DEVICE_NAME","BUILDING","ROOM","MOUNT_HEIGHT","CABLE_ID","CABLE_TYPE","BOARD","CABLE_SOURCE","MOUNT_WAY","GOFRA_TYPE","GOFRA_COLOR","GOFRA_ID","LOAD_TYPE","LOAD_NAME","CALC_POWER","LENGTH","LED_TYPE","COMMENT_1","COMMENT_2"],"definition_required":["DEVICE_NAME","BUILDING","ROOM","MOUNT_HEIGHT","CABLE_ID","CABLE_TYPE","BOARD","CABLE_SOURCE","MOUNT_WAY","GOFRA_TYPE","GOFRA_COLOR","GOFRA_ID","LOAD_TYPE","LOAD_NAME","CALC_POWER","LENGTH","LED_TYPE","COMMENT_1","COMMENT_2"]},
    "TRACK": {"required":[],"optional":["DEVICE_NAME","BUILDING","ROOM","MOUNT_HEIGHT","TRACK_ID","CABLE_ID","CABLE_TYPE","BOARD","CABLE_SOURCE","MOUNT_WAY","GOFRA_TYPE","GOFRA_COLOR","GOFRA_ID","TRACK_MOUNT_WAY","LOAD_NAME","LENGTH","COMMENT_1","COMMENT_2"],"definition_required":["DEVICE_NAME","BUILDING","ROOM","MOUNT_HEIGHT","TRACK_ID","CABLE_ID","CABLE_TYPE","BOARD","CABLE_SOURCE","MOUNT_WAY","GOFRA_TYPE","GOFRA_COLOR","GOFRA_ID","TRACK_MOUNT_WAY","LOAD_NAME","LENGTH","COMMENT_1","COMMENT_2"]},
    "TRACK_DALI": {"required":[],"optional":["DEVICE_NAME","BUILDING","ROOM","MOUNT_HEIGHT","TRACK_ID","CABLE_ID","CABLE_TYPE","BOARD","CABLE_SOURCE","MOUNT_WAY","GOFRA_TYPE","GOFRA_COLOR","GOFRA_ID","BUS_ID","BUS_SOURCE","BUS_CABLE_TYPE","BUS_MOUNT_WAY","BUS_GOFRA_TYPE","BUS_GOFRA_COLOR","BUS_GOFRA_ID","TRACK_MOUNT_WAY","LOAD_NAME","LENGTH","COMMENT_1","COMMENT_2"],"definition_required":["DEVICE_NAME","BUILDING","ROOM","MOUNT_HEIGHT","TRACK_ID","CABLE_ID","CABLE_TYPE","BOARD","CABLE_SOURCE","MOUNT_WAY","GOFRA_TYPE","GOFRA_COLOR","GOFRA_ID","BUS_ID","BUS_SOURCE","BUS_CABLE_TYPE","BUS_MOUNT_WAY","BUS_GOFRA_TYPE","BUS_GOFRA_COLOR","BUS_GOFRA_ID","TRACK_MOUNT_WAY","LOAD_NAME","LENGTH","COMMENT_1","COMMENT_2"]},
    "CONTROL": {"required":[],"optional":["DEVICE_NAME","BUILDING","ROOM","MOUNT_HEIGHT","CABLE_ID","CABLE_TYPE","BOARD","MOUNT_WAY","GOFRA_TYPE","GOFRA_COLOR","GOFRA_ID","LOAD_NAME","COMMENT_1","COMMENT_2"],"definition_required":["DEVICE_NAME","BUILDING","ROOM","MOUNT_HEIGHT","CABLE_ID","CABLE_TYPE","BOARD","MOUNT_WAY","GOFRA_TYPE","GOFRA_COLOR","GOFRA_ID","LOAD_NAME","COMMENT_1","COMMENT_2"]},
    "ETHERNET": {"required":[],"optional":["DEVICE_NAME","BUILDING","ROOM","MOUNT_HEIGHT","CABLE_ID","CABLE_TYPE","BOARD","CABLE_SOURCE","MOUNT_WAY","GOFRA_TYPE","GOFRA_COLOR","GOFRA_ID","LOAD_TYPE","LOAD_NAME","COMMENT_1","COMMENT_2"],"definition_required":["DEVICE_NAME","BUILDING","ROOM","MOUNT_HEIGHT","CABLE_ID","CABLE_TYPE","BOARD","CABLE_SOURCE","MOUNT_WAY","GOFRA_TYPE","GOFRA_COLOR","GOFRA_ID","LOAD_TYPE","LOAD_NAME","COMMENT_1","COMMENT_2"]},
    "OUTLET": {"required":[],"optional":["DEVICE_NAME","BUILDING","ROOM","MOUNT_HEIGHT","CABLE_ID","CABLE_TYPE","BOARD","CABLE_SOURCE","MOUNT_WAY","GOFRA_TYPE","GOFRA_COLOR","GOFRA_ID","LOAD_TYPE","LOAD_NAME","CALC_POWER","PHASE","COMMENT_1","COMMENT_2"],"definition_required":["DEVICE_NAME","BUILDING","ROOM","MOUNT_HEIGHT","CABLE_ID","CABLE_TYPE","BOARD","CABLE_SOURCE","MOUNT_WAY","GOFRA_TYPE","GOFRA_COLOR","GOFRA_ID","LOAD_TYPE","LOAD_NAME","CALC_POWER","PHASE","COMMENT_1","COMMENT_2"]},
    "DALI_OUTLET": {"required":[],"optional":["DEVICE_NAME","BUILDING","ROOM","MOUNT_HEIGHT","CABLE_ID","CABLE_TYPE","BOARD","CABLE_SOURCE","MOUNT_WAY","GOFRA_TYPE","GOFRA_COLOR","GOFRA_ID","BUS_POINT_ID","BUS_SOURCE","BUS_CABLE_TYPE","BUS_MOUNT_WAY","BUS_GOFRA_TYPE","BUS_GOFRA_COLOR","BUS_GOFRA_ID","LOAD_TYPE","LOAD_NAME","CALC_POWER","PHASE","COMMENT_1","COMMENT_2"],"definition_required":["DEVICE_NAME","BUILDING","ROOM","MOUNT_HEIGHT","CABLE_ID","CABLE_TYPE","BOARD","CABLE_SOURCE","MOUNT_WAY","GOFRA_TYPE","GOFRA_COLOR","GOFRA_ID","BUS_POINT_ID","BUS_SOURCE","BUS_CABLE_TYPE","BUS_MOUNT_WAY","BUS_GOFRA_TYPE","BUS_GOFRA_COLOR","BUS_GOFRA_ID","LOAD_TYPE","LOAD_NAME","CALC_POWER","PHASE","COMMENT_1","COMMENT_2"]},
    "CABLE_NO_LOAD": {"required":[],"optional":["DEVICE_NAME","BUILDING","ROOM","MOUNT_HEIGHT","CABLE_ID","CABLE_TYPE","BOARD","CABLE_SOURCE","MOUNT_WAY","GOFRA_TYPE","GOFRA_COLOR","GOFRA_ID","LOAD_NAME","COMMENT_1","COMMENT_2"],"definition_required":["DEVICE_NAME","BUILDING","ROOM","MOUNT_HEIGHT","CABLE_ID","CABLE_TYPE","BOARD","CABLE_SOURCE","MOUNT_WAY","GOFRA_TYPE","GOFRA_COLOR","GOFRA_ID","LOAD_NAME","COMMENT_1","COMMENT_2"]},
    "RS485": {"required":[],"optional":["DEVICE_NAME","BUILDING","ROOM","MOUNT_HEIGHT","BUS_POINT_ID","BUS_CABLE_TYPE","BUS_MOUNT_WAY","BUS_GOFRA_TYPE","BUS_GOFRA_COLOR","BUS_GOFRA_ID","LOAD_NAME","COMMENT_1","COMMENT_2"],"definition_required":["DEVICE_NAME","BUILDING","ROOM","MOUNT_HEIGHT","BUS_POINT_ID","BUS_CABLE_TYPE","BUS_MOUNT_WAY","BUS_GOFRA_TYPE","BUS_GOFRA_COLOR","BUS_GOFRA_ID","LOAD_NAME","COMMENT_1","COMMENT_2"]},
    "EQUIPMENT": {"required":[],"optional":["DEVICE_NAME","BUILDING","ROOM","MOUNT_HEIGHT","CABLE_ID","CABLE_TYPE","BOARD","CABLE_SOURCE","MOUNT_WAY","GOFRA_TYPE","GOFRA_COLOR","GOFRA_ID","LOAD_NAME","CALC_POWER","PHASE","COMMENT_1","COMMENT_2"],"definition_required":["DEVICE_NAME","BUILDING","ROOM","MOUNT_HEIGHT","CABLE_ID","CABLE_TYPE","BOARD","CABLE_SOURCE","MOUNT_WAY","GOFRA_TYPE","GOFRA_COLOR","GOFRA_ID","LOAD_NAME","CALC_POWER","PHASE","COMMENT_1","COMMENT_2"]},
    "BOARD": {"required":[],"optional":["DEVICE_NAME","BUILDING","ROOM","MOUNT_HEIGHT","BOARD_ID","CABLE_ID","CABLE_TYPE","BOARD","CABLE_SOURCE","MOUNT_WAY","GOFRA_TYPE","GOFRA_COLOR","GOFRA_ID","LOAD_TYPE","LOAD_NAME","CALC_POWER","COMMENT_1","COMMENT_2"],"definition_required":["DEVICE_NAME","BUILDING","ROOM","MOUNT_HEIGHT","BOARD_ID","CABLE_ID","CABLE_TYPE","BOARD","CABLE_SOURCE","MOUNT_WAY","GOFRA_TYPE","GOFRA_COLOR","GOFRA_ID","LOAD_TYPE","LOAD_NAME","CALC_POWER","COMMENT_1","COMMENT_2"]},
    "EL_BOX": {"required":[],"optional":["DEVICE_NAME","BUILDING","ROOM","MOUNT_HEIGHT","BOX_ID","CABLE_ID","CABLE_TYPE","BOARD","CABLE_SOURCE","MOUNT_WAY","GOFRA_TYPE","GOFRA_COLOR","GOFRA_ID","CABLE_TRANSIT","BUS_ID","BUS_SOURCE","BUS_CABLE_TYPE","BUS_MOUNT_WAY","BUS_GOFRA_TYPE","BUS_GOFRA_COLOR","BUS_GOFRA_ID","COMMENT_1","COMMENT_2"],"definition_required":["DEVICE_NAME","BUILDING","ROOM","MOUNT_HEIGHT","BOX_ID","CABLE_ID","CABLE_TYPE","BOARD","CABLE_SOURCE","MOUNT_WAY","GOFRA_TYPE","GOFRA_COLOR","GOFRA_ID","CABLE_TRANSIT","BUS_ID","BUS_SOURCE","BUS_CABLE_TYPE","BUS_MOUNT_WAY","BUS_GOFRA_TYPE","BUS_GOFRA_COLOR","BUS_GOFRA_ID","COMMENT_1","COMMENT_2"]},